{
  "manifest_schema": "0.1.3",
  "repo": "litert-community/LFM2.5-1.2B-Instruct",
  "generated": "2026-10-07",
  "generator": "make_manifest.py",
  "model": {
    "display_name": "LFM2.5-1.2B-Instruct",
    "base_model": "LiquidAI/LFM2.5-1.2B-Instruct",
    "architecture": "lfm2-hybrid (short-conv + attention)",
    "parameters_b": 1.2,
    "license": "see LICENSE file in repo",
    "context_length": 4096,
    "capabilities": {
      "vision": false,
      "audio": false,
      "thinking": {
        "declared": true,
        "channel": {
          "start": "<think>",
          "end": "</think>"
        },
        "control": "model"
      },
      "channels": [
        {
          "name": "thought",
          "start": "<think>",
          "end": "</think>"
        }
      ]
    }
  },
  "variants": [
    {
      "file": "LFM2.5-1.2B-Instruct_int4.litertlm",
      "sha256": "96041e6c72b1d2e9b73a122870606bbf18a3819bf14c43c3f2b74685ed62c24d",
      "size_bytes": 736015744,
      "sections": [
        {
          "type": "LlmMetadataProto",
          "size_bytes": 2223
        },
        {
          "type": "ExecutorMetadataProto",
          "size_bytes": 1421
        },
        {
          "type": "HF_Tokenizer_Zlib",
          "size_bytes": 906962
        },
        {
          "type": "TFLiteModel",
          "size_bytes": 735049088,
          "model_type": "tf_lite_prefill_decode"
        }
      ],
      "quantization": "dynamic int4 block-32 linears, fp32 activations (CPU-lineage export)",
      "backends": [
        "cpu"
      ],
      "default_backend": "cpu",
      "min_runtime_version": "0.15.0",
      "recommended": [
        {
          "platform": "android",
          "device_class": "midrange",
          "backend": "cpu",
          "reason": "on phone-class memory bandwidth int4 decodes ~1.7x faster than int8 and is 41% smaller"
        },
        {
          "platform": "ios",
          "backend": "cpu",
          "reason": "iOS CPU is the verified path for this family"
        }
      ],
      "known_issues": [
        "This export lineage emits INT64 ops + GATHER_ND in the short-conv patch: GPU engine creation fails — use the _int4_gpu re-export for GPU backends"
      ]
    },
    {
      "file": "LFM2.5-1.2B-Instruct_int4_gpu.litertlm",
      "sha256": "97e6a9700208f59fce2ceb993cd6c18ea77ada8c2a940f68332004f38a404671",
      "size_bytes": 736220768,
      "sections": [
        {
          "type": "LlmMetadataProto",
          "size_bytes": 2223
        },
        {
          "type": "ExecutorMetadataProto",
          "size_bytes": 1421
        },
        {
          "type": "HF_Tokenizer_Zlib",
          "size_bytes": 906962
        },
        {
          "type": "TFLiteModel",
          "size_bytes": 735254112,
          "model_type": "tf_lite_prefill_decode"
        }
      ],
      "quantization": "dynamic int4 block-32 linears, fp32 activations; GPU-capable re-export (no INT64/GATHER_ND in the short-conv patch)",
      "backends": [
        "cpu",
        "gpu"
      ],
      "default_backend": "gpu",
      "min_runtime_version": "0.15.0",
      "recommended": [
        {
          "platform": "android",
          "device_class": "midrange-2023+",
          "backend": "gpu",
          "reason": "3-6x prefill and TTFT vs CPU on Tensor G3; decode is bandwidth-bound and roughly a wash"
        },
        {
          "platform": "macos",
          "backend": "gpu",
          "reason": "~11x prefill, ~4x decode vs CPU on the same file"
        },
        {
          "platform": "ios",
          "backend": "cpu",
          "reason": "the Metal GPU engine fails on this model family at runtime (tracked upstream); CPU is verified"
        },
        {
          "platform": "android",
          "device_class": "flagship",
          "backend": "gpu",
          "reason": "measured on one Galaxy S26 with one binary (S7 Android backfill 2026-09-05, 205-token prompt, 2 cold runs per backend, cooled before each run): gpu decodes 54.5 tok/s against cpu's 40.46 (1.3x), prefill 1018.3 vs 79.6-86.5 tok/s, peak 618 vs 1332 MB, engine init 6.6 vs 4.4 s. Same-device CPU control taken - a measured win for gpu on decode. int4_gpu is the GPU-lineage export; on this handset's CPU it decodes 40 tok/s, level with the CPU-lineage int8 file (39-41 tok/s, same day, same harness), so the GPU is where the flagship class gains. Both backends answered the probe correctly"
        }
      ],
      "requirements": {
        "platform_notes": [
          "Large --max-num-tokens costs decode speed on this family (~-24% at 4096 vs 1024)",
          "GPU backends keep a compiled-model cache (~2x model size) next to the model until the OS purges it"
        ]
      },
      "measured": [
        {
          "device": "Apple M4 Max",
          "os": "macOS",
          "backend": "gpu",
          "runtime": "litert-lm 0.16.0 (pip CLI benchmark)",
          "prompt_tokens": 256,
          "decode_tokens": 256,
          "prefill_tps": 3765.0,
          "decode_tps": 318.3,
          "ttft_s": 0.071,
          "max_num_tokens": 4096,
          "cache": "no",
          "runs": 3,
          "date": "2026-08-12",
          "source": "ship-lane Mac bench log; model card Performance table"
        },
        {
          "device": "Apple M4 Max",
          "os": "macOS",
          "backend": "cpu",
          "runtime": "litert-lm 0.16.0 (pip CLI benchmark)",
          "prompt_tokens": 256,
          "decode_tokens": 256,
          "prefill_tps": 337.0,
          "decode_tps": 80.5,
          "ttft_s": 0.77,
          "max_num_tokens": 4096,
          "cache": "no",
          "runs": 3,
          "date": "2026-08-12",
          "source": "ship-lane Mac bench log; model card Performance table"
        },
        {
          "device": "Pixel 8a (Tensor G3)",
          "os": "Android",
          "backend": "gpu",
          "runtime": "litert_lm_main built from the litert-lm v0.16.0 release tag (OpenCL)",
          "prompt_tokens": 263,
          "decode_tokens": 115,
          "prefill_tps": "188.3-192.6",
          "decode_tps": "21.0-21.2",
          "ttft_s": "1.41-1.44",
          "max_num_tokens": 4096,
          "runs": 3,
          "date": "2026-08-12",
          "source": "ship-lane Pixel 8a bench log; model card Performance table"
        },
        {
          "device": "Pixel 8a (Tensor G3)",
          "os": "Android",
          "backend": "cpu",
          "runtime": "litert_lm_main built from the litert-lm v0.16.0 release tag",
          "prompt_tokens": 263,
          "decode_tokens": 205,
          "prefill_tps": "38.2-53.9",
          "decode_tps": "15.2-24.3",
          "ttft_s": "4.9-7.0",
          "max_num_tokens": 4096,
          "runs": 3,
          "date": "2026-08-12",
          "source": "ship-lane Pixel 8a bench log (CPU rows spread with thermal throttling); model card Performance table"
        },
        {
          "device": "Galaxy S26 (SM-S942Q, Qualcomm SM8850, Adreno)",
          "backend": "gpu",
          "runtime": "litert_lm_advanced_main v0.16.0, LiteRT CL delegate",
          "prompt_tokens": 205,
          "decode_tokens": 159,
          "prefill_tps": 1018.3,
          "decode_tps": 54.5,
          "ttft_s": 0.22,
          "load_s": 6.6,
          "peak_memory_mb": 618,
          "cache": "no",
          "runs": 2,
          "date": "2026-09-05",
          "source": "S7 Android backfill: 205-token prompt with --benchmark, 2 cold runs (compile/weight caches deleted between runs, device cooled below 42 C before each run); GPU gate full LITERT_CL delegation (6440 ops across 12 subgraphs), generation verified on the gate prompt; the cpu row of the same date is the same-device control"
        },
        {
          "device": "Galaxy S26 (SM-S942Q, Qualcomm SM8850, Adreno)",
          "backend": "cpu",
          "runtime": "litert_lm_advanced_main v0.16.0 (XNNPACK CPU)",
          "prompt_tokens": 205,
          "decode_tokens": 137,
          "prefill_tps": "79.6-86.5",
          "decode_tps": 40.46,
          "ttft_s": "2.39-2.6",
          "load_s": 4.4,
          "peak_memory_mb": 1332,
          "cache": "no",
          "runs": 2,
          "date": "2026-09-05",
          "source": "S7 Android backfill: same-device CPU control - identical binary, prompt file and flags, only --backend differs; 205-token prompt with --benchmark, 2 cold runs (compile/weight caches deleted between runs, device cooled below 42 C before each run); same-device control for the gpu row of the same date"
        }
      ],
      "known_issues": [
        "iPhone Metal: engine fails on this family at runtime (Mac WebGPU passes the same file) — use CPU on iOS; tracked upstream"
      ]
    },
    {
      "file": "LFM2.5-1.2B-Instruct_int8.litertlm",
      "sha256": "41c192feac3a028cfd35f4a0c5db2a70961dc388ecb4ad2cac9a094be0a078ea",
      "size_bytes": 1247091440,
      "sections": [
        {
          "type": "LlmMetadataProto",
          "size_bytes": 2223
        },
        {
          "type": "ExecutorMetadataProto",
          "size_bytes": 1421
        },
        {
          "type": "HF_Tokenizer_Zlib",
          "size_bytes": 906962
        },
        {
          "type": "TFLiteModel",
          "size_bytes": 1246124784,
          "model_type": "tf_lite_prefill_decode"
        }
      ],
      "quantization": "int8 linears only (wi8), fp32 activations (CPU-lineage export)",
      "backends": [
        "cpu"
      ],
      "measured": [
        {
          "device": "Galaxy S26 (SM-S942Q, Qualcomm SM8850, Adreno)",
          "backend": "cpu",
          "runtime": "litert_lm_advanced_main v0.16.0 (XNNPACK CPU)",
          "prompt_tokens": 205,
          "decode_tokens": 105,
          "prefill_tps": "424.4-491.1",
          "decode_tps": "38.98-40.96",
          "ttft_s": "0.44-0.51",
          "load_s": 1.9,
          "peak_memory_mb": 1782,
          "cache": "no",
          "runs": 2,
          "date": "2026-09-05",